{
  "id": "d0e1f2a3-b4c5-6789-3456-90abcdef0123",
  "actor": {
    "objectType": "Agent",
    "account": {
      "homePage": "https://lms.institution.ac.za",
      "name": "stu-f7a3b2c1"
    }
  },
  "verb": {
    "id": "http://adlnet.gov/expapi/verbs/asked",
    "display": { "en": "asked" }
  },
  "object": {
    "objectType": "Activity",
    "id": "https://lms.institution.ac.za/courses/aclit-2026/help/req-2026-03-08-001",
    "definition": {
      "type": "https://w3id.org/xapi/aclit/v1/activity-types/help-request",
      "name": { "en": "Help Request: Citation Formatting" },
      "description": { "en": "Student requests tutor assistance with citation formatting in APA style." }
    }
  },
  "context": {
    "extensions": {
      "https://w3id.org/xapi/aclit/v1/extensions/help-type": "tutor-question"
    },
    "contextActivities": {
      "grouping": [
        {
          "objectType": "Activity",
          "id": "https://lms.institution.ac.za/sessions/2026-03-08T09-15-00Z/stu-f7a3b2c1",
          "definition": {
            "type": "https://w3id.org/xapi/aclit/v1/activity-types/session",
            "name": { "en": "Learning Session 2026-03-08T09:15:00Z" }
          }
        }
      ],
      "category": [
        {
          "objectType": "Activity",
          "id": "https://w3id.org/xapi/aclit/v1",
          "definition": {
            "type": "http://adlnet.gov/expapi/activities/profile",
            "name": { "en": "Academic Literacies Learning Analytics Profile" }
          }
        }
      ]
    }
  },
  "timestamp": "2026-03-08T10:45:00Z"
}
